{
  "$schema": "https://json-schema.org/draft/2020-12/schema",
  "$id": "https://e2e.dev/schema/conformance-v1.schema.json",
  "title": "e2e conformance-1",
  "type": "object",
  "additionalProperties": false,
  "required": ["schemaVersion", "profile", "suiteVersion", "manifestSha256", "implementation", "startedAt", "finishedAt", "status", "results"],
  "properties": {
    "schemaVersion": { "const": "conformance-1" },
    "profile": {
      "enum": ["sdk-0.1", "runner-0.1", "core-0.1", "web-0.1", "driver-1", "agent-protocol-1", "report-1", "session-1", "conformance-1"]
    },
    "suiteVersion": { "type": "string", "minLength": 1, "maxLength": 128 },
    "manifestSha256": { "type": "string", "pattern": "^[a-f0-9]{64}$" },
    "implementation": {
      "type": "object",
      "additionalProperties": false,
      "required": ["name", "version", "artifactSha256"],
      "properties": {
        "name": { "type": "string", "minLength": 1, "maxLength": 256 },
        "version": { "type": "string", "minLength": 1, "maxLength": 128 },
        "artifactSha256": { "type": "string", "pattern": "^[a-f0-9]{64}$" }
      }
    },
    "startedAt": { "$ref": "#/$defs/timestamp" },
    "finishedAt": { "$ref": "#/$defs/timestamp" },
    "status": { "enum": ["passed", "failed"] },
    "results": {
      "type": "array",
      "minItems": 1,
      "items": { "$ref": "#/$defs/result" }
    },
    "extensions": {
      "type": "object",
      "maxProperties": 64,
      "propertyNames": {
        "type": "string",
        "maxLength": 128,
        "pattern": "^(?:[a-z0-9]+(?:[.-][a-z0-9]+)+|@[a-z0-9][a-z0-9._-]*/[a-z0-9][a-z0-9._-]*)$"
      },
      "additionalProperties": true
    }
  },
  "$defs": {
    "timestamp": {
      "type": "string",
      "pattern": "^[0-9]{4}-[0-9]{2}-[0-9]{2}T[0-9]{2}:[0-9]{2}:[0-9]{2}\\.[0-9]{3}Z$",
      "format": "date-time"
    },
    "relativePath": {
      "type": "string",
      "minLength": 1,
      "pattern": "^(?!/)(?![A-Za-z]:)(?!.*\\\\)(?!.*(?:^|/)\\.\\.?(?:/|$))(?!.*//)[^/\\u0000]+(?:/[^/\\u0000]+)*$"
    },
    "evidence": {
      "type": "object",
      "additionalProperties": false,
      "required": ["path", "sha256"],
      "properties": {
        "path": { "$ref": "#/$defs/relativePath" },
        "sha256": { "type": "string", "pattern": "^[a-f0-9]{64}$" }
      }
    },
    "result": {
      "type": "object",
      "additionalProperties": false,
      "required": ["requirementId", "status", "evidence"],
      "properties": {
        "requirementId": { "type": "string", "pattern": "^[A-Z]+(?:-[A-Z]+)*-[0-9]{3}$" },
        "status": { "enum": ["passed", "failed"] },
        "message": { "type": "string", "maxLength": 8192 },
        "evidence": {
          "type": "array",
          "minItems": 1,
          "items": { "$ref": "#/$defs/evidence" }
        }
      }
    }
  }
}
