{
  "schemaVersion": "conformance-1",
  "profile": "sdk-0.1",
  "suiteVersion": "0.1.0",
  "manifestSha256": "c7045d0cce318eab295f191e099ffa356f392d2ce666fad13dcdb5a58ec67e6a",
  "implementation": {
    "name": "e2e",
    "version": "0.1.0",
    "artifactSha256": "92592860484fc82248ff1a6d44ebc3c23332a88a775f28e46658cec9e91cb244"
  },
  "startedAt": "2026-07-24T12:00:00.000Z",
  "finishedAt": "2026-07-24T12:00:01.000Z",
  "status": "passed",
  "results": [
    {
      "requirementId": "SDK-TYPES-001",
      "status": "passed",
      "evidence": [
        {
          "path": "evidence/sdk.txt",
          "sha256": "92592860484fc82248ff1a6d44ebc3c23332a88a775f28e46658cec9e91cb244"
        }
      ]
    },
    {
      "requirementId": "SDK-TYPES-002",
      "status": "passed",
      "evidence": [
        {
          "path": "evidence/sdk.txt",
          "sha256": "92592860484fc82248ff1a6d44ebc3c23332a88a775f28e46658cec9e91cb244"
        }
      ]
    },
    {
      "requirementId": "SDK-TYPES-003",
      "status": "passed",
      "evidence": [
        {
          "path": "evidence/sdk.txt",
          "sha256": "92592860484fc82248ff1a6d44ebc3c23332a88a775f28e46658cec9e91cb244"
        }
      ]
    },
    {
      "requirementId": "SDK-TYPES-004",
      "status": "passed",
      "evidence": [
        {
          "path": "evidence/sdk.txt",
          "sha256": "92592860484fc82248ff1a6d44ebc3c23332a88a775f28e46658cec9e91cb244"
        }
      ]
    },
    {
      "requirementId": "SDK-TYPES-005",
      "status": "passed",
      "evidence": [
        {
          "path": "evidence/sdk.txt",
          "sha256": "92592860484fc82248ff1a6d44ebc3c23332a88a775f28e46658cec9e91cb244"
        }
      ]
    },
    {
      "requirementId": "SDK-TYPES-006",
      "status": "passed",
      "evidence": [
        {
          "path": "evidence/sdk.txt",
          "sha256": "92592860484fc82248ff1a6d44ebc3c23332a88a775f28e46658cec9e91cb244"
        }
      ]
    }
  ]
}
